{
  "schemaVersion": "xpath-rule-pack/v1",
  "id": "official.weibo-user-feed.xpath",
  "name": "Weibo User Feed",
  "version": "0.1.0",
  "description": "Static JSON API mapping for m.weibo.cn user timelines. Entries are mblog cards filtered by card_type==9.",
  "parameters": {
    "urlTemplate": "https://m.weibo.cn/api/container/getIndex?type=uid&value={uid}&containerid=107603{uid}",
    "params": [
      {
        "key": "type",
        "label": "内容类型",
        "type": "select",
        "options": [
          { "value": "user", "label": "用户微博" }
        ],
        "required": true
      },
      {
        "key": "uid",
        "label": "微博用户 UID",
        "type": "text",
        "placeholder": "例如 2803301701",
        "required": true
      }
    ],
    "defaults": {
      "maxItems": 40,
      "maxPages": 5
    }
  },
  "candidates": [
    {
      "id": "weibo-user-feed",
      "pageType": "social-feed",
      "priority": 90,
      "detect": ["mblog", "card_type", "created_at"],
      "promptRule": "Weibo user feed: JSON API on m.weibo.cn. Items are mblog objects under data.cards where card_type==9. Each mblog has text (HTML body), user.screen_name, created_at, reposts_count, comments_count, attitudes_count, pics[] with large.url, bid for constructing weibo.com links. Pagination via data.cardlistInfo.since_id cursor.",
      "selectors": {
        "items": "data.cards[?(@.card_type==9)]",
        "title": "user.screen_name",
        "url": "https://weibo.com/{user.id}/{bid}",
        "summary": "text",
        "publishedAt": "created_at",
        "author": "user.screen_name",
        "image": "pics[0].large.url",
        "content": "text",
        "nextPage": "data.cardlistInfo.since_id",
        "customFields": [
          { "key": "reposts", "label": "转发", "xpath": "reposts_count", "scope": "item" },
          { "key": "comments", "label": "评论", "xpath": "comments_count", "scope": "item" },
          { "key": "likes", "label": "点赞", "xpath": "attitudes_count", "scope": "item" },
          { "key": "source", "label": "来源", "xpath": "source", "scope": "item" }
        ],
        "maxItems": 40
      }
    }
  ]
}
