{
  "schemaVersion": "xpath-rule-pack/v1",
  "id": "official.naixi-forum.xpath",
  "name": "Naixi Forum XPath Rules",
  "version": "0.1.0",
  "description": "Static XPath rules for naixi.net forum thread lists with section-based browsing.",
  "auth": {
    "checkUrl": "https://forum.naixi.net/home.php?mod=spacecp",
    "loggedInXPath": "//a[contains(@href,'logout') or contains(@href,'action=logout')]"
  },
  "candidates": [
    {
      "id": "naixi-forum-thread-list",
      "pageType": "forum-thread-list",
      "priority": 90,
      "detect": ["threadlisttableid", "kmlist", "km_subject"],
      "selectors": {
        "items": "//*[@id='threadlisttableid']/li[contains(@class, 'kmlist')]",
        "title": ".//*[contains(@class, 'km_subject')]",
        "url": ".//a[contains(@class, 'kmtit')]/@href",
        "summary": ".//*[contains(@class, 'kmfoot')]",
        "publishedAt": ".//*[contains(@class, 'kmtime')]/*[@title][1]/@title | .//*[contains(@class, 'kmtime')]",
        "author": ".//*[contains(@class, 'kmfoot')]/a[starts-with(@href, 'space-uid')][1]",
        "content": null,
        "detailContent": "//*[@id='postlist']//td[contains(@class, 't_f') and starts-with(@id, 'postmessage_')][1]",
        "contentCleanup": [
          {
            "pattern": "(?is)<div\\s+class=\"quote\".*?</div>",
            "replacement": ""
          },
          {
            "pattern": "(?is)<ignore_js_op>.*?</ignore_js_op>",
            "replacement": ""
          }
        ],
        "image": ".//a[contains(@class, 'kmimg')]//img/@src",
        "nextPage": "//a[contains(@class, 'nxt')]/@href",
        "customFields": [
          {
            "key": "section",
            "label": "Section",
            "xpath": ".//*[contains(@class, 'kmfoot')]/a[contains(@class, 'kmico_bk')][1]",
            "scope": "item"
          },
          {
            "key": "replies",
            "label": "Replies",
            "xpath": ".//*[contains(@class, 'kmpl')][1]",
            "scope": "item"
          },
          {
            "key": "views",
            "label": "Views",
            "xpath": ".//*[contains(@class, 'kmck')][1]",
            "scope": "item"
          }
        ],
        "maxItems": 20,
        "reader": {
          "removeSelectors": ["//ignore_js_op", "//*[contains(concat(' ', normalize-space(@class), ' '), ' quote ')]"],
          "resolveRelativeUrls": true,
          "rewriteLinks": true,
          "showCustomFields": true,
          "layout": { "typography": "serif", "width": "normal", "immersive": false }
        }
      }
    }
  ],
  "parameters": {
    "urlTemplate": "https://forum.naixi.net/{sectionId}.html",
    "sections": [
      {
        "id": "forum-64-1",
        "path": ["板块", "内容区", "茶馆", "日常"],
        "url": "https://forum.naixi.net/forum-64-1.html"
      },
      {
        "id": "forum-64-2",
        "path": ["板块", "内容区", "茶馆", "交易"],
        "url": "https://forum.naixi.net/forum-64-2.html"
      },
      {
        "id": "forum-64-3",
        "path": ["板块", "内容区", "茶馆", "数科"],
        "url": "https://forum.naixi.net/forum-64-3.html"
      },
      {
        "id": "forum-64-4",
        "path": ["板块", "内容区", "茶馆", "数字"],
        "url": "https://forum.naixi.net/forum-64-4.html"
      },
      {
        "id": "forum-65-1",
        "path": ["板块", "内容区", "技术", "建站"],
        "url": "https://forum.naixi.net/forum-65-1.html"
      },
      {
        "id": "forum-65-2",
        "path": ["板块", "内容区", "技术", "编程"],
        "url": "https://forum.naixi.net/forum-65-2.html"
      },
      {
        "id": "forum-65-3",
        "path": ["板块", "内容区", "技术", "AI"],
        "url": "https://forum.naixi.net/forum-65-3.html"
      },
      {
        "id": "forum-66-1",
        "path": ["板块", "内容区", "资源", "软件"],
        "url": "https://forum.naixi.net/forum-66-1.html"
      },
      {
        "id": "forum-66-2",
        "path": ["板块", "内容区", "资源", "教程"],
        "url": "https://forum.naixi.net/forum-66-2.html"
      },
      {
        "id": "forum-62-1",
        "path": ["板块", "站务区", "公告"],
        "url": "https://forum.naixi.net/forum-62-1.html"
      },
      {
        "id": "forum-63-1",
        "path": ["板块", "站务区", "反馈"],
        "url": "https://forum.naixi.net/forum-63-1.html"
      }
    ],
    "defaults": {
      "maxItems": 20
    }
  }
}
